{
  "schema": "underlay.migration.promotion_decision_lint.v1",
  "schema_version": 1,
  "generated_at": "2026-03-02T20:56:30.822Z",
  "decision_file": "/Users/betterthanclay/Dev/projects/underlay/runtime/promotion-lint-envelope-smoke/metadata/acowtancy.demo.2026-03-02.promotion-decision.json",
  "schema_file": "/Users/betterthanclay/Dev/projects/underlay/docs/guides/code/205-legacy-migration-framework/promotion-decision.schema.json",
  "status": "passed",
  "error_count": 0,
  "errors": []
}
